{
  "schema_version": "zenodex.fcis.m6.task-evidence.v1",
  "task_id": "H06",
  "base_sha": "e55be951bd043a1b212c6ba8e0ddd75646fc8523",
  "source_head_sha": "1405df9e8a8787b27630c53f3d2aac0190a16698",
  "source_head_tree": "4372d0fa4b8237e947399e7d2ef0a7aa7a23cc43",
  "branch": "codex/task-H03-deterministic-crash-20260801",
  "status": "TESTED",
  "evidence_files": [
    "experiments/fcis_m6_h06_durability_config.py",
    "tests/core/test_fcis_m6_h06_durability_config.py",
    "docs/research/m6_tasks/TASK_H06_PLAN.md",
    "docs/research/m6_tasks/TASK_H06_DURABILITY_PROFILE_V1.json",
    "docs/research/m6_tasks/TASK_H06_REPORT.md",
    "docs/research/m6_tasks/TASK_H06_EVIDENCE.json",
    "docs/research/m6_tasks/TASK_H06_SOURCE_MANIFEST.sha256"
  ],
  "commands": [
    "PYTHONPATH=. python3 -m pytest -q tests/core/test_fcis_m6_h06_durability_config.py",
    "python3 -m py_compile experiments/fcis_m6_h06_durability_config.py tests/core/test_fcis_m6_h06_durability_config.py",
    "python3 -m ruff check experiments/fcis_m6_h06_durability_config.py tests/core/test_fcis_m6_h06_durability_config.py",
    "python3 -m ruff format --check experiments/fcis_m6_h06_durability_config.py tests/core/test_fcis_m6_h06_durability_config.py",
    "python3 -m mypy --strict experiments/fcis_m6_h06_durability_config.py tests/core/test_fcis_m6_h06_durability_config.py",
    "git diff --check",
    "python3 docs/research/m6_tasks/validate_task_packet.py docs/research/m6_tasks H06",
    "sha256sum --check --strict docs/research/m6_tasks/TASK_H06_SOURCE_MANIFEST.sha256"
  ],
  "tool_versions": {
    "python": "Python 3.12.3",
    "ruff": "ruff 0.16.0",
    "mypy": "mypy 2.1.0 (compiled: yes)",
    "pytest": "pytest 7.4.4",
    "git": "git version 2.54.0"
  },
  "source_hashes": {
    "experiments/fcis_m6_h06_durability_config.py": "30d79366bbc137d4a73cd86a4aeaf25d1a21f12618d16600c60ebb8bb8cd2455",
    "tests/core/test_fcis_m6_h06_durability_config.py": "41fa86773c73c46c79b72a2eeb9be2ab4090cba36c14f372a21a04aaa4b1815e",
    "docs/research/m6_tasks/TASK_H06_PLAN.md": "6df8a565dcaad1d0f784eeb41e0e7b986a1011f7f5d6e92dd7d275f9e50cd8ea",
    "docs/research/m6_tasks/TASK_H06_DURABILITY_PROFILE_V1.json": "92f2f56977c428209a49b661cd6094d93c34d9e3ec1eee9061a1fc88dcdec658"
  },
  "results": {
    "focused_tests": "pass; 11 passed",
    "profile_acceptance": "pass; WAL, FULL, foreign_keys ON, busy_timeout >= 5000, NORMAL locking",
    "weakening_matrix": "pass; 5 independent weakening cases rejected",
    "implementation_commit": "1405df9e8a8787b27630c53f3d2aac0190a16698",
    "implementation_tree": "4372d0fa4b8237e947399e7d2ef0a7aa7a23cc43",
    "implementation_parent": "e55be951bd043a1b212c6ba8e0ddd75646fc8523"
  },
  "mutants": [],
  "nonclaims": [
    "H06 is an isolated research checker and is not mounted in production.",
    "H06 does not prove filesystem power-loss durability, WAL/fsync semantics, or PostgreSQL configuration.",
    "H06 does not prove concurrent linearization, runtime reachability, migration, outbox delivery, or value movement.",
    "M6 remains unmounted and non-promotable."
  ]
}
