{
  "schema_version": "zenodex.fcis.m6.task-evidence.v1",
  "task_id": "I04",
  "base_sha": "79ed2a34312cab21c7335d1eb16e80f9715a2905",
  "source_head_sha": "1cd7680a9f8fd7ca221e99ab281df75f3bae36f5",
  "source_head_tree": "23a77e8d396a41c942ade2fc15647cd092fe510e",
  "branch": "codex/task-H03-deterministic-crash-20260801",
  "status": "TESTED",
  "evidence_files": [
    "experiments/fcis_m6_i04_destination_dedup.py",
    "tests/core/test_fcis_m6_i04_destination_dedup.py",
    "docs/research/m6_tasks/TASK_I04_DESTINATION_DEDUP_SCHEMA_V1.json",
    "docs/research/m6_tasks/TASK_I04_PLAN.md",
    "docs/research/m6_tasks/TASK_I04_REPORT.md",
    "docs/research/m6_tasks/TASK_I04_EVIDENCE.json",
    "docs/research/m6_tasks/TASK_I04_SOURCE_MANIFEST.sha256"
  ],
  "commands": [
    "python3 -m ruff format experiments/fcis_m6_i04_destination_dedup.py tests/core/test_fcis_m6_i04_destination_dedup.py",
    "python3 -m ruff check experiments/fcis_m6_i04_destination_dedup.py tests/core/test_fcis_m6_i04_destination_dedup.py",
    "python3 -m ruff format --check experiments/fcis_m6_i04_destination_dedup.py tests/core/test_fcis_m6_i04_destination_dedup.py",
    "python3 -m mypy --strict experiments/fcis_m6_i04_destination_dedup.py tests/core/test_fcis_m6_i04_destination_dedup.py",
    "python3 -m py_compile experiments/fcis_m6_i04_destination_dedup.py tests/core/test_fcis_m6_i04_destination_dedup.py",
    "PYTHONPATH=. python3 -m pytest -q tests/core/test_fcis_m6_i04_destination_dedup.py",
    "python3 docs/research/m6_tasks/validate_task_packet.py docs/research/m6_tasks I04",
    "sha256sum --check --strict docs/research/m6_tasks/TASK_I04_SOURCE_MANIFEST.sha256",
    "git diff --check"
  ],
  "tool_versions": {
    "python": "Python 3.12.3",
    "ruff": "ruff 0.16.0",
    "mypy": "mypy 2.1.0 (compiled: yes)",
    "pytest": "pytest 7.4.4",
    "git": "git version 2.54.0"
  },
  "source_hashes": {
    "experiments/fcis_m6_i04_destination_dedup.py": "f3327a00086b255b9712d472e9d14e54a35a9a56878992cc556cb8b75015f5e6",
    "tests/core/test_fcis_m6_i04_destination_dedup.py": "394e56698dc22a224c1badb42ae3e93f74aad8817b2a32acce7ac6244d95e956",
    "docs/research/m6_tasks/TASK_I04_DESTINATION_DEDUP_SCHEMA_V1.json": "901682daa1715cb687a876f1e60b9e1c2dc46861681a6b919049f1b88eb31e49",
    "docs/research/m6_tasks/TASK_I04_PLAN.md": "e6b11781dea120af465bdd70ea8c655e2b65a71b923d9d95bcec135741bc2e49"
  },
  "results": {
    "focused_tests": "pass; 6 passed",
    "mechanism_coverage": "pass; native key, query-by-effect-ID, and receipt-table paths",
    "duplicate_idempotence": "pass; stable receipt root and unchanged destination state",
    "collision_rejection": "pass; payload, destination, and adapter-profile crossings reject",
    "unmountable_contracts": "pass; forged and unsupported contracts reject",
    "collection_rejection": "pass; duplicate and noncanonical records reject",
    "implementation_commit": "1cd7680a9f8fd7ca221e99ab281df75f3bae36f5",
    "implementation_tree": "23a77e8d396a41c942ade2fc15647cd092fe510e",
    "implementation_parent": "79ed2a34312cab21c7335d1eb16e80f9715a2905"
  },
  "mutants": [],
  "nonclaims": [
    "I04 is an immutable research destination model and is not a network adapter.",
    "I04 does not prove receipt provenance, delivery, lost-ack recovery, or production idempotency.",
    "I04 does not prove runtime mounting or value movement.",
    "M6 remains unmounted and non-promotable."
  ]
}
