{
  "schema_version": "zenodex.fcis.m6.task-evidence.v1",
  "task_id": "J04",
  "base_sha": "accbd4fb82d0a70a9d0aff850ec7696f0d447f13",
  "source_head_sha": "5fff44d7fd542838b5a69436a614a08889fd0780",
  "source_head_tree": "d316e3f7e8a7c1e796be1cb32c8060e0fba3d263",
  "branch": "codex/task-H03-deterministic-crash-20260801",
  "status": "TESTED",
  "evidence_files": [
    "tools/check_fcis_m6_j04_migration_manifest.py",
    "tests/core/test_fcis_m6_j04_migration_manifest.py",
    "docs/research/m6_tasks/TASK_J04_MIGRATION_MANIFEST_V1.json",
    "docs/research/m6_tasks/TASK_J04_PLAN.md",
    "docs/research/m6_tasks/TASK_J04_REPORT.md",
    "docs/research/m6_tasks/TASK_J04_EVIDENCE.json",
    "docs/research/m6_tasks/TASK_J04_SOURCE_MANIFEST.sha256"
  ],
  "commands": [
    "python3 tools/check_fcis_m6_j04_migration_manifest.py docs/research/m6_tasks/TASK_J04_MIGRATION_MANIFEST_V1.json",
    "PYTHONPATH=. python3 -m pytest -q tests/core/test_fcis_m6_j04_migration_manifest.py",
    "python3 -m ruff check tools/check_fcis_m6_j04_migration_manifest.py tests/core/test_fcis_m6_j04_migration_manifest.py",
    "python3 -m ruff format --check tools/check_fcis_m6_j04_migration_manifest.py tests/core/test_fcis_m6_j04_migration_manifest.py",
    "python3 -m mypy --strict tools/check_fcis_m6_j04_migration_manifest.py tests/core/test_fcis_m6_j04_migration_manifest.py",
    "python3 -m py_compile tools/check_fcis_m6_j04_migration_manifest.py tests/core/test_fcis_m6_j04_migration_manifest.py",
    "python3 -m json.tool docs/research/m6_tasks/TASK_J04_MIGRATION_MANIFEST_V1.json",
    "python3 docs/research/m6_tasks/validate_task_packet.py docs/research/m6_tasks J04",
    "sha256sum --check --strict docs/research/m6_tasks/TASK_J04_SOURCE_MANIFEST.sha256",
    "git diff --check"
  ],
  "tool_versions": {
    "python": "Python 3.12.3",
    "ruff": "ruff 0.16.0",
    "mypy": "mypy 2.1.0 (compiled: yes)",
    "pytest": "pytest 7.4.4",
    "git": "git version 2.54.0"
  },
  "source_hashes": {
    "tools/check_fcis_m6_j04_migration_manifest.py": "0ec43c60ae9a5384463ffbb95be3490e40f4210dcd7dcc04b03c6fa62f5986bb",
    "tests/core/test_fcis_m6_j04_migration_manifest.py": "920c08fe0590e5972b3386636fe461dccedb422f504a567d109bc1170a6e7604",
    "docs/research/m6_tasks/TASK_J04_MIGRATION_MANIFEST_V1.json": "c56505bb4ed53dac93a8ad38ebf55fc9ccdf248369edf2f271ae0a48c44deea1",
    "docs/research/m6_tasks/TASK_J04_PLAN.md": "a28979757ce3ff365d8f063fb05572a4488dab9f4294cfa78fcd88b96abc650a"
  },
  "results": {
    "manifest_checker": "pass; canonical root/sequence-bound manifest",
    "focused_tests": "pass; 6 passed",
    "negative_witnesses": "pass; root collapse, quiescence, transport checker, and activation mutations reject",
    "self_hash": "pass; manifest_root matches canonical body",
    "implementation_commit": "5fff44d7fd542838b5a69436a614a08889fd0780",
    "implementation_tree": "d316e3f7e8a7c1e796be1cb32c8060e0fba3d263",
    "implementation_parent": "accbd4fb82d0a70a9d0aff850ec7696f0d447f13"
  },
  "mutants": [],
  "nonclaims": [
    "J04 is a checked migration manifest and is not a migration implementation.",
    "J04 does not prove transport, replay, quiescence, rollback, or datastore behavior.",
    "J04 does not prove runtime mounting or value movement.",
    "M6 remains unmounted and non-promotable."
  ]
}
